{
  "schema_version": "dev-gov-v1-unit-definition",
  "unit": "LU-SOURCE-AUTHORITY-WIRING-04D-V1",
  "role": "producer",
  "mode": "writer",
  "branch": "audit/minimum-authority-delta-04d-lu-source-authority-wiring",
  "base_sha": "02fe470d4a3a5a6d6e0f500521a5a4cc4fcb6bba",
  "ancestry_policy": "descendant_of_base",
  "allowed_paths": [
    "packages/mps-governance-runtime/src/SourceAuthorityVerification.ts",
    "packages/mps-lu/src/governance/LuSourceAuthorityWiring.ts",
    "packages/mps-lu/src/artifacts/LocalizationAssessmentArtifact.ts",
    "packages/mps-lu/src/governance/GovernedAssessmentPersistence.ts",
    "packages/mps-lu/src/execution/LuExecutionKernelClient.ts",
    "packages/mps-lu/src/index.ts",
    "src/application/generate-localization-report.usecase.ts",
    "packages/mps-lu/tests/LuSourceAuthorityWiring04D.test.ts",
    "docs/architecture/audits/MINIMUM-AUTHORITY-DELTA-04D-LU-SOURCE-AUTHORITY-WIRING.md",
    "governance/devgov/units/lu-source-authority-wiring-04d-v1.json"
  ],
  "forbidden_paths": [
    ".github/**",
    "scripts/devgov/**",
    "governance/devgov/schema/**",
    "prisma/**",
    "packages/mps-governance/src/**",
    "packages/mps-compliance/src/**",
    "packages/mps-runtime/src/**",
    "server/security/**"
  ],
  "required_red": [
    {
      "id": "lu-source-authority-wiring",
      "command": "bash",
      "args": [
        "-lc",
        "node -e \"const fs=require('fs');const a=fs.readFileSync('packages/mps-lu/src/artifacts/LocalizationAssessmentArtifact.ts','utf8');const k=fs.readFileSync('packages/mps-lu/src/execution/LuExecutionKernelClient.ts','utf8');const p=fs.readFileSync('packages/mps-lu/src/governance/GovernedAssessmentPersistence.ts','utf8');if(!a.includes('authority_evidence_ref')||!k.includes('verifyLuSourceAuthorityForAssessment')||!p.includes('authority_decision_unverified'))process.exit(1);\" && npx vitest run --config vitest.config.ts packages/mps-lu/tests/LuSourceAuthorityWiring04D.test.ts packages/mps-compliance/tests/AuthorityGenericTrustReconciliation04C.test.ts packages/mps-governance-runtime/tests/AuthorityGenericRuntimeReconciliation04C.test.ts"
      ],
      "timeout_ms": 180000,
      "expected_classification": "FAIL",
      "required_head": "base_sha"
    }
  ],
  "required_green": [
    {
      "id": "lu-source-authority-wiring",
      "command": "bash",
      "args": [
        "-lc",
        "node -e \"const fs=require('fs');const a=fs.readFileSync('packages/mps-lu/src/artifacts/LocalizationAssessmentArtifact.ts','utf8');const k=fs.readFileSync('packages/mps-lu/src/execution/LuExecutionKernelClient.ts','utf8');const p=fs.readFileSync('packages/mps-lu/src/governance/GovernedAssessmentPersistence.ts','utf8');if(!a.includes('authority_evidence_ref')||!k.includes('verifyLuSourceAuthorityForAssessment')||!p.includes('authority_decision_unverified'))process.exit(1);\" && npx vitest run --config vitest.config.ts packages/mps-lu/tests/LuSourceAuthorityWiring04D.test.ts packages/mps-compliance/tests/AuthorityGenericTrustReconciliation04C.test.ts packages/mps-governance-runtime/tests/AuthorityGenericRuntimeReconciliation04C.test.ts"
      ],
      "timeout_ms": 180000,
      "expected_classification": "PASS",
      "required_head": "candidate_sha"
    }
  ],
  "trusted_execution": {
    "issuer": "github-actions:JbmbAb/Milj-beslut-V1.2:devgov-v0-attest",
    "key_id": "devgov-ci-ed25519-v1"
  },
  "remote": {
    "name": "origin",
    "branch": "audit/minimum-authority-delta-04d-lu-source-authority-wiring",
    "push_policy": "no_force",
    "absent_policy": "deny_absent"
  }
}
