{
  "schema_version": "dev-gov-v1-unit-definition",
  "unit": "DEVGOV-HELPERS-STEP3-PROVEN-DOC-V1",
  "role": "producer",
  "mode": "writer",
  "branch": "docs/devgov-helpers-step3-proven",
  "base_sha": "8a9b7464756d005e9b466fba74e183d21e9f117e",
  "ancestry_policy": "descendant_of_base",
  "allowed_paths": [
    "docs/architecture/audits/DEVGOV-HELPERS-STEP3-PROVEN.md",
    "governance/devgov/units/devgov-helpers-step3-proven-doc-v1.json"
  ],
  "forbidden_paths": [
    ".github/**",
    "scripts/**",
    "governance/devgov/schema/**",
    "prisma/**",
    "packages/**",
    "server/**",
    "src/**",
    "tests/**",
    "components/**",
    "docs/architecture/audits/DEVGOV-HELPERS-STEP3.md",
    "governance/devgov/units/devgov-helpers-step3-v1.json"
  ],
  "required_red": [
    {
      "id": "proven-record-binds-devgov-helpers-step3-evidence",
      "command": "node",
      "args": [
        "-e",
        "\nconst fs = require('node:fs');\nconst V = (m) => { console.error('DGH_STEP3_PROVEN_VIOLATION: ' + m); process.exit(1); };\nconst H = (m) => { console.error('DGH_STEP3_PROVEN_HARNESS_ERROR: ' + m); process.exit(2); };\ntry {\n  const p = \"docs/architecture/audits/DEVGOV-HELPERS-STEP3-PROVEN.md\";\n  let s;\n  try { s = fs.readFileSync(p, 'utf8'); }\n  catch (e) { if (e && e.code === 'ENOENT') V('the PROVEN record does not exist on this tree: ' + p); H('cannot read ' + p + ': ' + (e && e.message)); }\n  const req = JSON.parse(process.argv[1]);\n  if (!Array.isArray(req) || req.length === 0) H('no required bindings supplied');\n  const missing = req.filter((x) => !s.includes(x));\n  if (missing.length > 0) V('the PROVEN record lacks required bindings: ' + missing.join(' | '));\n  const grab = (label) => { const m = new RegExp('\\\\*\\\\*' + label + ':\\\\*\\\\* `([0-9a-f]{40})`').exec(s); return m && m[1]; };\n  const mt = grab('Merge tree'), ct = grab('Candidate tree');\n  if (!mt || !ct) V('merge tree / candidate tree are not both stated as 40-hex SHAs');\n  if (mt !== ct) V('merge tree ' + mt + ' differs from candidate tree ' + ct + ': finalization is blocked');\n  console.log('DGH_STEP3_PROVEN_OK: record binds all required evidence; merge tree == candidate tree ' + mt);\n} catch (e) { H('unexpected: ' + (e && e.stack ? e.stack : e)); }\n",
        "[\"**Final state:** PROVEN\",\"864a62f7d1f6f480c41a9c9395e6ce7b920fed99\",\"2d2489c65db15a9adc056e62016638e775f78019\",\"8a9b7464756d005e9b466fba74e183d21e9f117e\",\"a5dbffc318152fe0e9b032a7bdf017f767ea0229\",\"35748983305\",\"35827987410\",\"#170\",\"DEV-GOV-V0 / trusted-execution\",\"Trusted RED/GREEN verified for exact candidate SHA\",\"Squash and rebase were not used.\",\"isolation-test-prettier-violation\",\"dev-helpers-cli-absent\",\"dev-helpers-unit-tests\",\"an independent cold audit occurred for it (none did\",\"verification was self-testing only\",\"`scripts/devgov/devgov.mjs`\",\"`.github/workflows/**`\",\"`governance/devgov/schema/**`\",\"stale outcome-id\",\"`DEVGOV-HELPERS-STEP3 = PROVEN`\"]"
      ],
      "expected_classification": "FAIL",
      "required_head": "base_sha",
      "blocked_exit_codes": [
        2
      ],
      "timeout_ms": 30000
    }
  ],
  "required_green": [
    {
      "id": "proven-record-binds-devgov-helpers-step3-evidence",
      "command": "node",
      "args": [
        "-e",
        "\nconst fs = require('node:fs');\nconst V = (m) => { console.error('DGH_STEP3_PROVEN_VIOLATION: ' + m); process.exit(1); };\nconst H = (m) => { console.error('DGH_STEP3_PROVEN_HARNESS_ERROR: ' + m); process.exit(2); };\ntry {\n  const p = \"docs/architecture/audits/DEVGOV-HELPERS-STEP3-PROVEN.md\";\n  let s;\n  try { s = fs.readFileSync(p, 'utf8'); }\n  catch (e) { if (e && e.code === 'ENOENT') V('the PROVEN record does not exist on this tree: ' + p); H('cannot read ' + p + ': ' + (e && e.message)); }\n  const req = JSON.parse(process.argv[1]);\n  if (!Array.isArray(req) || req.length === 0) H('no required bindings supplied');\n  const missing = req.filter((x) => !s.includes(x));\n  if (missing.length > 0) V('the PROVEN record lacks required bindings: ' + missing.join(' | '));\n  const grab = (label) => { const m = new RegExp('\\\\*\\\\*' + label + ':\\\\*\\\\* `([0-9a-f]{40})`').exec(s); return m && m[1]; };\n  const mt = grab('Merge tree'), ct = grab('Candidate tree');\n  if (!mt || !ct) V('merge tree / candidate tree are not both stated as 40-hex SHAs');\n  if (mt !== ct) V('merge tree ' + mt + ' differs from candidate tree ' + ct + ': finalization is blocked');\n  console.log('DGH_STEP3_PROVEN_OK: record binds all required evidence; merge tree == candidate tree ' + mt);\n} catch (e) { H('unexpected: ' + (e && e.stack ? e.stack : e)); }\n",
        "[\"**Final state:** PROVEN\",\"864a62f7d1f6f480c41a9c9395e6ce7b920fed99\",\"2d2489c65db15a9adc056e62016638e775f78019\",\"8a9b7464756d005e9b466fba74e183d21e9f117e\",\"a5dbffc318152fe0e9b032a7bdf017f767ea0229\",\"35748983305\",\"35827987410\",\"#170\",\"DEV-GOV-V0 / trusted-execution\",\"Trusted RED/GREEN verified for exact candidate SHA\",\"Squash and rebase were not used.\",\"isolation-test-prettier-violation\",\"dev-helpers-cli-absent\",\"dev-helpers-unit-tests\",\"an independent cold audit occurred for it (none did\",\"verification was self-testing only\",\"`scripts/devgov/devgov.mjs`\",\"`.github/workflows/**`\",\"`governance/devgov/schema/**`\",\"stale outcome-id\",\"`DEVGOV-HELPERS-STEP3 = PROVEN`\"]"
      ],
      "expected_classification": "PASS",
      "required_head": "candidate_sha",
      "blocked_exit_codes": [
        2
      ],
      "timeout_ms": 30000
    }
  ],
  "trusted_execution": {
    "issuer": "github-actions:JbmbAb/Milj-beslut-V1.2:devgov-v0-attest",
    "key_id": "devgov-ci-ed25519-v1"
  },
  "remote": {
    "name": "origin",
    "branch": "docs/devgov-helpers-step3-proven",
    "push_policy": "no_force",
    "absent_policy": "deny_absent"
  }
}
